{
  "$schema": "../../../../schemas/0.3.0/specimen.schema.json",
  "schemaVersion": "0.3.0",
  "id": "ADDISPEC-PBF-CHEMISTRY-DISK-25X3",
  "title": "Chemistry analysis disk",
  "entityType": "Specimen",
  "status": "digital-geometry-verified",
  "process": {
    "category": "PBF-LB/M",
    "normativeConformance": "not-assessed"
  },
  "purpose": [
    "chemical analysis",
    "material verification"
  ],
  "design": {
    "geometryFamily": "chemistry-disk",
    "units": "mm",
    "coordinateSystem": "right-handed",
    "nominalDimensions": {
      "diameter": 25,
      "thickness": 3
    },
    "buildOrientation": {
      "buildAxis": "+Z",
      "orientationStatus": "template-not-qualified"
    }
  },
  "lifecycle": {
    "addiPlanRole": "analysis specimen template",
    "distinction": "A specimen is built in a Build Job; a sample may later be extracted or prepared from it."
  },
  "artifacts": [
    {
      "role": "exact-exchange-geometry",
      "format": "STEP",
      "path": "geometry/ADDISPEC-PBF-CHEMISTRY-DISK-25X3.step",
      "sha256": "b4d6624e6999bff7d175d0854fb900e9a032f4694ec89820b5a75a775f620157",
      "bytes": 6128
    }
  ],
  "provenance": {
    "createdBy": "NuCOS AddiSpec catalog experiment",
    "authoringSystem": "PartMode typed headless agent",
    "createdAt": "2026-08-19T22:29:43.374Z"
  },
  "qualification": {
    "manufacturingQualified": false,
    "limitations": [
      "Suitability depends on the selected analytical method and preparation route."
    ],
    "missingEvidence": [
      "Build Job",
      "machine and parameter profile",
      "material lot",
      "build position and orientation confirmation",
      "post-processing route",
      "measurement result and uncertainty",
      "release decision"
    ]
  }
}
