{
  "$schema": "../../../../schemas/0.3.0/specimen.schema.json",
  "schemaVersion": "0.3.0",
  "id": "ADDISPEC-PBF-DENSITY-CUBE-10",
  "title": "Density cube 10 mm",
  "entityType": "Specimen",
  "status": "digital-geometry-verified",
  "process": {
    "category": "PBF-LB/M",
    "normativeConformance": "not-assessed"
  },
  "purpose": [
    "relative density",
    "porosity",
    "parameter screening"
  ],
  "design": {
    "geometryFamily": "density-cube",
    "units": "mm",
    "coordinateSystem": "right-handed",
    "nominalDimensions": {
      "width": 10,
      "depth": 10,
      "height": 10
    },
    "buildOrientation": {
      "buildAxis": "+Z",
      "orientationStatus": "template-not-qualified"
    }
  },
  "lifecycle": {
    "addiPlanRole": "as-built witness specimen",
    "distinction": "A specimen is built in a Build Job; a sample may later be extracted or prepared from it."
  },
  "artifacts": [
    {
      "role": "exact-exchange-geometry",
      "format": "STEP",
      "path": "geometry/ADDISPEC-PBF-DENSITY-CUBE-10.step",
      "sha256": "c26c59e523b605cd4d447b6208c892023c83742fbf68c380cfdb53ab4d9ebc85",
      "bytes": 15834
    }
  ],
  "provenance": {
    "createdBy": "NuCOS AddiSpec catalog experiment",
    "authoringSystem": "PartMode typed headless agent",
    "createdAt": "2026-08-19T22:29:38.040Z"
  },
  "qualification": {
    "manufacturingQualified": false,
    "limitations": [
      "Measurement method and acceptance criteria are not prescribed."
    ],
    "missingEvidence": [
      "Build Job",
      "machine and parameter profile",
      "material lot",
      "build position and orientation confirmation",
      "post-processing route",
      "measurement result and uncertainty",
      "release decision"
    ]
  }
}
