{
  "$schema": "../../../../schemas/0.3.0/specimen.schema.json",
  "schemaVersion": "0.3.0",
  "id": "ADDISPEC-PBF-OVERHANG-RAMP-45",
  "title": "45 degree overhang ramp",
  "entityType": "Specimen",
  "status": "digital-geometry-verified",
  "process": {
    "category": "PBF-LB/M",
    "normativeConformance": "not-assessed"
  },
  "purpose": [
    "overhang capability",
    "downskin evaluation"
  ],
  "design": {
    "geometryFamily": "overhang-ramp",
    "units": "mm",
    "coordinateSystem": "right-handed",
    "nominalDimensions": {
      "length": 40,
      "profileHeight": 20,
      "width": 10,
      "nominalOverhangAngleDeg": 45
    },
    "buildOrientation": {
      "buildAxis": "-Y",
      "orientationStatus": "corrected-nominal-direction-not-qualified"
    }
  },
  "lifecycle": {
    "addiPlanRole": "geometric-capability artifact",
    "distinction": "A specimen is built in a Build Job; a sample may later be extracted or prepared from it."
  },
  "artifacts": [
    {
      "role": "exact-exchange-geometry",
      "format": "STEP",
      "path": "geometry/ADDISPEC-PBF-OVERHANG-RAMP-45.step",
      "sha256": "b54cca5433f514a335809fe8b4c91f626adcea30028fa7b9cf1aecd0cb8e6aaa",
      "bytes": 16269
    }
  ],
  "provenance": {
    "createdBy": "NuCOS AddiSpec catalog experiment",
    "authoringSystem": "PartMode typed headless agent",
    "createdAt": "2026-08-19T22:29:45.537Z"
  },
  "qualification": {
    "manufacturingQualified": false,
    "limitations": [
      "buildAxis is expressed in the stored STEP frame. The intended growth direction is -Y, not +Z; the latter produces a vertical wall rather than an inclined downskin.",
      "The core-four benchmark maps source -Y to model +Z with a -90 degree rotation about X and a 10 mm translation along model Z.",
      "The nominal downskin is 45 degrees to the build plane. Support strategy, actual machine placement and physical process capability remain unqualified."
    ],
    "missingEvidence": [
      "Build Job",
      "machine and parameter profile",
      "material lot",
      "build position and orientation confirmation",
      "post-processing route",
      "measurement result and uncertainty",
      "release decision"
    ]
  },
  "evidence": "evidence.json"
}
